四川师范大学2017年物理与电子工程学院实验室建设采购项目公开招标结果公告,http://202.61.88.152:9002/view/staticpags/jggg/2017-06-06/d60156d216fb4b73a099d8a23ac6cd28.html
成都中医药大学附属医院2017年医疗设备采购项目（第二次）公开招标采购公告,http://202.61.88.152:9002/view/staticpags/gkzbcggg/2017-06-06/5405865ddf884352977d5dbd7b0bd100.html
"四川省广元监狱,四川省川北监狱,四川省绵阳监狱2017年度罪犯大宗生活物资(米面油肉)采购项目公开招标采购更正公告",http://202.61.88.152:9002/view/staticpags/gzgg/2017-06-06/f1b2c3d1c74140c69f08d1675e21cd7c.html
"四川省凉山监狱,四川省攀西监狱,四川省荞窝监狱2017年度罪犯大宗生活物资(米面油肉)采购项目公开招标采购更正公告",http://202.61.88.152:9002/view/staticpags/gzgg/2017-06-06/098a8a14b7374ca5a4ee109d7456b618.html
宜宾学院教学实验实训平台设备采购项目（第二次）公开招标采购公告,http://202.61.88.152:9002/view/staticpags/gkzbcggg/2017-06-06/66fefb20f75c46739d290b32397fe39a.html
四川省卫生和计划生育信息中心四川省基层医疗卫生机构管理信息系统省级灾备中心托管服务政府采购竞争性磋商结果公告,http://202.61.88.152:9002/view/staticpags/jggg/2017-06-06/fc09ac06e39b40b886b1bb0e9a697d60.html
四川省教育管理信息中心四川省教育管理信息中心四川省民族地区教育信息管理系统公开招标采购更正公告,http://202.61.88.152:9002/view/staticpags/gzgg/2017-06-06/67941e4ad1134b329501225dafb81e3f.html
川北医学院大门改建工程竞争性磋商采购公告,http://202.61.88.152:9002/view/staticpags/jzxcscggg/2017-06-06/04a1a90156fe4235ad41781d757b4aa4.html
四川民族学院实验室设备采购及环境搭建项目公开招标采购公告,http://202.61.88.152:9002/view/staticpags/gkzbcggg/2017-06-06/adcc9a7b3ea14e24a920159eb52f0559.html
四川省环境监测总站超级站综合管理决策系统建设及自动称量系统运行维护等项目更正公告,http://202.61.88.152:9002/view/staticpags/gzgg/2017-06-06/0e26204d683943afaeabc17067ee22fa.html
四川交通职业技术学院2017年房屋修缮工程项目政府采购（第二次）竞争性磋商采购更正公告,http://202.61.88.152:9002/view/staticpags/gzgg/2017-06-06/4ded79cda9384295b2e8ab21b4320ecf.html
川北医学院附属医院木质办公家具政府采购公开招标采购公告,http://202.61.88.152:9002/view/staticpags/gkzbcggg/2017-06-06/29b79047d1e946da8343799c2aab5008.html
四川省体育科学研究所2017医疗及体育科研设备采购项目公开招标采购公告,http://202.61.88.152:9002/view/staticpags/gkzbcggg/2017-06-06/3c7d6483279548e9959bebdce651e8dc.html
四川省中医药科学院中医研究所2017年度医疗设备采购项目公开招标采购更正公告,http://202.61.88.152:9002/view/staticpags/gzgg/2017-06-06/403383e6ea01420aa1af7a45882ab0dc.html
四川师范大学2017年商学院实验室建设（第二次）采购项目公开招标结果公告,http://202.61.88.152:9002/view/staticpags/jggg/2017-06-06/2289b42c0ba545e8b1e5d73433c9b7f0.html
四川省新闻出版广电局四川版权综合服务平台安全升级功能 扩展项目（第二次）公开招标采购公告,http://202.61.88.152:9002/view/staticpags/gkzbcggg/2017-06-06/95c8dc70796349d287e048609955499b.html
四川交通职业技术学院工业机器人技术新专业实训基地建设采购项目（第二次）公开招标采购公告,http://202.61.88.152:9002/view/staticpags/gkzbcggg/2017-06-06/83320e88270c426f8e58cc2810f70b1e.html
四川文化产业职业学院（四川省干部函授学院）学生宿舍改造项目竞争性磋商采购更正公告,http://202.61.88.152:9002/view/staticpags/gzgg/2017-06-06/8c402ac878fb40358106a366e6437912.html
四川省卫生和计划生育信息中心四川省省级健康医疗大数据分析应用平台采购项目公开招标采购公告,http://202.61.88.152:9002/view/staticpags/gkzbcggg/2017-06-06/8900d72ff6ac4dde876d3ab15d22c6be.html
四川师范大学信息集成实施服务及服务器政府采购项目公开招标采购公告,http://202.61.88.152:9002/view/staticpags/gkzbcggg/2017-05-27/ddb6f891d9b34732b332888c79f8c9d0.html
四川省工业环境监测研究院科研实验楼电梯更新改造竞争性谈判结果公告,http://202.61.88.152:9002/view/staticpags/jggg/2017-06-06/156213a219d74611b72df93999d34e69.html
四川省公安厅监所管理总队四川省看守所厨房设施采购项目更正公告,http://202.61.88.152:9002/view/staticpags/gzgg/2017-06-06/9e5e122dcaa64a228b5668574fa944d6.html
四川省体育彩票管理中心新媒体广告服务采购项目公开招标结果公告,http://202.61.88.152:9002/view/staticpags/jggg/2017-06-06/a02ddc2c6ae745738e44c0b695a6dd8e.html
四川省国土资源厅资料馆地质资料信息集群化产业化建设竞争性磋商结果公告,http://202.61.88.152:9002/view/staticpags/jggg/2017-05-17/342d38de0331499594dcb710ba665073.html
四川师范大学2017年实验室及教室窗帘采购项目公开招标结果公告,http://202.61.88.152:9002/view/staticpags/jggg/2017-06-06/faf34f5b28c14ddd828595c1e04f62b1.html
四川省水产局农业部长江上游水产品质量安全监督检验中心检测设备采购项目公开招标采购公告,http://202.61.88.152:9002/view/staticpags/gkzbcggg/2017-06-05/e435bf0269214e6b86160383006ef75d.html
四川省国土资源厅资料馆存储设备采购项目竞争性谈判结果公告,http://202.61.88.152:9002/view/staticpags/jggg/2017-06-05/8cdc7d9c165a46c3b3b85357f4d83760.html
成都理工大学成都理工大学南北翼楼电路改造工程竞争性磋商采购更正公告,http://202.61.88.152:9002/view/staticpags/gzgg/2017-06-06/8c53cd2a00f94a3b97718e0d88386132.html
四川省国土资源厅信息中心CA认证系统（川政采单[2017]3号）单一来源结果公告,http://202.61.88.152:9002/view/staticpags/jggg/2017-06-06/19cc8d8f325a40be9d4b048f4dfb125c.html
西南科技大学接触角测量仪等设备采购公开招标采购公告,http://202.61.88.152:9002/view/staticpags/gkzbcggg/2017-06-06/4c200dadc856412ea4975bd407b0a212.html
四川工商职业技术学院云存储设备采购项目竞争性谈判采购公告,http://202.61.88.152:9002/view/staticpags/jzxtpcggg/2017-06-06/cd31920215ff4cedb0a503eff86ad875.html
四川省资阳强制隔离戒毒所、四川省新华强制隔离戒毒所四川省戒毒管理局彩超等医疗设备政府采购项目竞争性磋商结果公告,http://202.61.88.152:9002/view/staticpags/jggg/2017-06-06/3077fd80f1794a44b88d5fb9968bd09c.html
西南科技大学材料本科实验室教学设备公开招标采购公告,http://202.61.88.152:9002/view/staticpags/gkzbcggg/2017-06-06/b07197d1f948466dae20c2da6f64b51c.html
四川师范大学2017年服装学院实验室建设采购项目公开招标结果公告,http://202.61.88.152:9002/view/staticpags/jggg/2017-06-06/4d281af4ac744cb28cb3d48914b8ddd8.html
成都理工大学成都理工大学2017年图书馆纸质图书供应商入围采购项目公开招标采购公告,http://202.61.88.152:9002/view/staticpags/gkzbcggg/2017-06-06/9029e6db121c4d4db17530a2ac1544b7.html
四川师范大学2017年等级保护测评及网站安全监测服务采购项目（第二次）公开招标采购公告,http://202.61.88.152:9002/view/staticpags/gkzbcggg/2017-06-05/f319915a4fa74e0da374180475c84122.html
四川师范大学2017年标准化食堂维修改造(二期)工程采购项目竞争性磋商结果公告,http://202.61.88.152:9002/view/staticpags/jggg/2017-06-06/ea6d487a1b704e43aba573df07dafdee.html
中国国际贸易促进委员会四川省分会成都智博会展览宣传服务竞争性磋商结果公告,http://202.61.88.152:9002/view/staticpags/jggg/2017-05-31/30b29aa3ad3c470bbead5db124250356.html
四川省民政厅编制出版四川省县级行政区域界线详图集川政采招〔2016〕347号政府采购项目公开招标采购公告,http://202.61.88.152:9002/view/staticpags/gkzbcggg/2017-06-05/b4ab1984d57d44929d6b15d6b49dc1fc.html
四川建筑职业技术学院（德阳）建筑智能化与电气化实训中心采购项目更正公告,http://202.61.88.152:9002/view/staticpags/gzgg/2017-06-05/f6df2f0158fc411697b49cfa151f137e.html
四川省绵阳强制隔离戒毒所、四川省新华强制隔离戒毒所强戒人员生活物资（米、面、油）采购（第二次）公开招标采购公告,http://202.61.88.152:9002/view/staticpags/gkzbcggg/2017-06-06/cfd9f184fa85447eb404e19bdcdc916e.html
四川建筑职业技术学院（德阳）四川建筑职业技术学院信息系和工管系实训室建设采购项目（第二次）公开招标采购公告,http://202.61.88.152:9002/view/staticpags/gkzbcggg/2017-06-06/314f1ebeb7404613b94dea289c70d845.html
四川省蚕丝学校会计专业教学软件政府采购更正公告,http://202.61.88.152:9002/view/staticpags/gzgg/2017-06-06/05ce1bfd7a0446739073fe35f6fdb352.html
川北医学院高坪校区新建学生食堂厨房二次装修（含天然气）及厨房设备工程竞争性磋商采购公告,http://202.61.88.152:9002/view/staticpags/jzxcscggg/2017-06-06/7695b97ed4334949bcbe9ac6593f1c8d.html
四川省川西监狱藏犯监区标识标牌采购项目更正公告,http://202.61.88.152:9002/view/staticpags/gzgg/2017-06-06/89d711eefcf84fb383284f8bc610cf13.html
四川省内江监狱刀刺隔离网政府更正公告,http://202.61.88.152:9002/view/staticpags/gzgg/2017-06-02/b19627e4e5eb4e78b14db53bcbdfb396.html
四川师范大学2017年影视与传媒学院实验室建设采购项目公开招标结果公告,http://202.61.88.152:9002/view/staticpags/jggg/2017-06-06/0df53e7fd0654e359f33089c6b327560.html
四川省农业科学院遥感应用研究所地理信息系统软件开发服务政府采购项目公开招标结果公告,http://202.61.88.152:9002/view/staticpags/jggg/2017-06-05/f99b2285d60a4f1c8ccbeb74c2e9decb.html
四川省农产品质量安全中心四川省农产品质量安全追溯管理平台及四川省农产品质量安全网格化移动监管平台运营维护服务采购项目公开招标结果公告,http://202.61.88.152:9002/view/staticpags/jggg/2017-06-06/54779b8e53ca48698274b747182b7135.html
四川师范大学2017年图书与档案信息中心实验室建设采购项目公开招标结果公告,http://202.61.88.152:9002/view/staticpags/jggg/2017-06-06/f8623db8772a4c2aae7daea45aab7d52.html
四川省动物疫病预防控制中心2017年牛副伤寒疫苗单一来源采购公告,http://202.61.88.152:9002/view/staticpags/dylycggg/2017-06-05/2c56ab1b813243ecb3f940fbbcb948c3.html
成都中医药大学附院针灸学校实验室设备和中控机柜采购与安装项目（第二次）竞争性谈判采购公告,http://202.61.88.152:9002/view/staticpags/jzxtpcggg/2017-05-31/1220948f45e2469cb63ebaf976f4265d.html
四川信息职业技术学院2017年物业管理服务(第二次）采购项目公开招标采购公告,http://202.61.88.152:9002/view/staticpags/gkzbcggg/2017-06-02/909e031e9ef24cab9bcd6db401051a50.html
四川省食品药品学校2017年省级补助综合治理采购项目竞争性磋商采购公告,http://202.61.88.152:9002/view/staticpags/jzxcscggg/2017-06-06/e80f715f458a4132a9996e01491f3757.html
成都中医药大学附院针灸学校中医康复保健国家级示范专业建设项目（第二次）竞争性磋商采购公告,http://202.61.88.152:9002/view/staticpags/jzxcscggg/2017-05-31/767494b0f31f495bac479585b34a4c24.html
